{
  "$schema": "https://json-schema.org/draft/2020-12/schema",
  "$id": "https://wstein.github.io/sourcesteward/schemas/v1/release-oci-result.schema.json",
  "title": "SourceSteward OCI build result (schema 1)",
  "type": "object",
  "additionalProperties": false,
  "required": ["schema_version", "kind", "index_digest", "platforms"],
  "properties": {
    "schema_version": {"const": 1},
    "kind": {"const": "oci-build-result"},
    "index_digest": {"type": "string", "pattern": "^sha256:[0-9a-f]{64}$"},
    "platforms": {
      "type": "array", "minItems": 1, "maxItems": 32,
      "items": {
        "type": "object", "additionalProperties": false, "required": ["os", "arch", "manifest_digest"],
        "properties": {
          "os": {"type": "string", "pattern": "^[a-z0-9_]{1,16}$"},
          "arch": {"type": "string", "pattern": "^[a-z0-9_]{1,16}$"},
          "variant": {"type": "string", "pattern": "^[a-z0-9_.]{1,16}$"},
          "manifest_digest": {"type": "string", "pattern": "^sha256:[0-9a-f]{64}$"}
        }
      }
    }
  }
}
